{
  "pack": {
    "code": "ke-cbe",
    "name": "Kenya Competency-Based Education (CBE) - Junior and Senior School example",
    "version": "2026.1.0",
    "country": "KE",
    "issuers": [
      "KICD",
      "KNEC",
      "Ministry of Education"
    ],
    "effective_from": "2026-01-01",
    "supersedes": "ke-cbc@2024.2.0",
    "languages": [
      "en",
      "sw"
    ],
    "requires_engine": ">=1.0.0",
    "sources": [
      {
        "title": "Basic Education Curriculum Framework",
        "issuer": "KICD",
        "url": "https://kicd.ac.ke/",
        "retrieved": "2026-09-01"
      }
    ],
    "verification": {
      "status": "draft",
      "verified_by": [],
      "notes": "Example only. Bands and learning-area lists are illustrative and must be checked against the current KICD/KNEC circular before release."
    },
    "overridable": [
      "grading_scales.cbe_8_level.bands",
      "reports.*.page"
    ]
  },
  "structure": {
    "stages": [
      {
        "code": "JS",
        "name": "Junior School",
        "levels": [
          "G7",
          "G8",
          "G9"
        ]
      },
      {
        "code": "SS",
        "name": "Senior School",
        "levels": [
          "G10",
          "G11",
          "G12"
        ]
      }
    ],
    "levels": [
      {
        "code": "G7",
        "name": "Grade 7",
        "ordinal": 7,
        "typical_age": 12,
        "next": "G8",
        "is_stage_exit": false,
        "national_assessment": null
      },
      {
        "code": "G8",
        "name": "Grade 8",
        "ordinal": 8,
        "typical_age": 13,
        "next": "G9",
        "is_stage_exit": false,
        "national_assessment": null
      },
      {
        "code": "G9",
        "name": "Grade 9",
        "ordinal": 9,
        "typical_age": 14,
        "next": "G10",
        "is_stage_exit": true,
        "national_assessment": "KJSEA"
      },
      {
        "code": "G10",
        "name": "Grade 10",
        "ordinal": 10,
        "typical_age": 15,
        "next": "G11",
        "is_stage_exit": false,
        "national_assessment": null
      },
      {
        "code": "G11",
        "name": "Grade 11",
        "ordinal": 11,
        "typical_age": 16,
        "next": "G12",
        "is_stage_exit": false,
        "national_assessment": null
      },
      {
        "code": "G12",
        "name": "Grade 12",
        "ordinal": 12,
        "typical_age": 17,
        "next": null,
        "is_stage_exit": true,
        "national_assessment": null
      }
    ],
    "pathways": [
      {
        "code": "STEM",
        "name": "STEM",
        "levels": [
          "G10",
          "G11",
          "G12"
        ]
      },
      {
        "code": "SOC",
        "name": "Social Sciences",
        "levels": [
          "G10",
          "G11",
          "G12"
        ]
      },
      {
        "code": "ASS",
        "name": "Arts and Sports Science",
        "levels": [
          "G10",
          "G11",
          "G12"
        ]
      }
    ],
    "calendar_template": {
      "year_kind": "calendar_year",
      "periods": [
        {
          "code": "T1",
          "kind": "term",
          "sequence": 1,
          "name": "Term 1",
          "typical": [
            "01-06",
            "04-04"
          ],
          "half_term": true
        },
        {
          "code": "T2",
          "kind": "term",
          "sequence": 2,
          "name": "Term 2",
          "typical": [
            "04-28",
            "08-01"
          ],
          "half_term": true
        },
        {
          "code": "T3",
          "kind": "term",
          "sequence": 3,
          "name": "Term 3",
          "typical": [
            "08-25",
            "10-31"
          ],
          "half_term": false
        }
      ],
      "note": "Exact dates are published annually by the Ministry; the wizard pre-fills these and the school confirms."
    }
  },
  "learning_areas": {
    "learning_areas": [
      {
        "code": "ENG",
        "name": "English",
        "short_name": "Eng",
        "kind": "core",
        "group": "languages",
        "levels": [
          "G7",
          "G8",
          "G9",
          "G10",
          "G11",
          "G12"
        ],
        "national_code": null,
        "components": [],
        "outcomes_ref": "outcomes/eng-js.json"
      },
      {
        "code": "KIS",
        "name": "Kiswahili",
        "short_name": "Kis",
        "kind": "core",
        "group": "languages",
        "levels": [
          "G7",
          "G8",
          "G9",
          "G10",
          "G11",
          "G12"
        ],
        "national_code": null,
        "components": [],
        "alternatives": [
          "KSL"
        ]
      },
      {
        "code": "KSL",
        "name": "Kenyan Sign Language",
        "short_name": "KSL",
        "kind": "optional",
        "group": "languages",
        "levels": [
          "G7",
          "G8",
          "G9",
          "G10",
          "G11",
          "G12"
        ],
        "national_code": null,
        "components": []
      },
      {
        "code": "MAT",
        "name": "Mathematics",
        "short_name": "Math",
        "kind": "core",
        "group": "mathematics",
        "levels": [
          "G7",
          "G8",
          "G9",
          "G10",
          "G11",
          "G12"
        ],
        "national_code": null,
        "components": []
      },
      {
        "code": "INT-SCI",
        "name": "Integrated Science",
        "short_name": "Int Sci",
        "kind": "core",
        "group": "sciences",
        "levels": [
          "G7",
          "G8",
          "G9"
        ],
        "national_code": null,
        "components": [
          {
            "code": "P1",
            "name": "Theory paper",
            "kind": "paper",
            "max_score": 80
          },
          {
            "code": "PR",
            "name": "Practical",
            "kind": "practical",
            "max_score": 20
          }
        ]
      },
      {
        "code": "AGR",
        "name": "Agriculture",
        "short_name": "Agri",
        "kind": "core",
        "group": "applied",
        "levels": [
          "G7",
          "G8",
          "G9"
        ],
        "national_code": null,
        "components": []
      },
      {
        "code": "SST",
        "name": "Social Studies",
        "short_name": "SST",
        "kind": "core",
        "group": "humanities",
        "levels": [
          "G7",
          "G8",
          "G9"
        ],
        "national_code": null,
        "components": []
      },
      {
        "code": "PTS",
        "name": "Pre-Technical Studies",
        "short_name": "PTS",
        "kind": "core",
        "group": "applied",
        "levels": [
          "G7",
          "G8",
          "G9"
        ],
        "national_code": null,
        "components": []
      },
      {
        "code": "CAS",
        "name": "Creative Arts and Sports",
        "short_name": "CAS",
        "kind": "elective",
        "group": "arts",
        "levels": [
          "G7",
          "G8",
          "G9"
        ],
        "national_code": null,
        "components": []
      },
      {
        "code": "CSL",
        "name": "Community Service Learning",
        "short_name": "CSL",
        "kind": "core",
        "group": "applied",
        "levels": [
          "G10",
          "G11",
          "G12"
        ],
        "national_code": null,
        "components": []
      },
      {
        "code": "PE",
        "name": "Physical Education",
        "short_name": "PE",
        "kind": "core",
        "group": "arts",
        "levels": [
          "G10",
          "G11",
          "G12"
        ],
        "national_code": null,
        "components": []
      },
      {
        "code": "BIO",
        "name": "Biology",
        "short_name": "Bio",
        "kind": "elective",
        "group": "sciences",
        "levels": [
          "G10",
          "G11",
          "G12"
        ],
        "national_code": null,
        "components": [],
        "pathways": [
          "STEM"
        ]
      },
      {
        "code": "CHE",
        "name": "Chemistry",
        "short_name": "Chem",
        "kind": "elective",
        "group": "sciences",
        "levels": [
          "G10",
          "G11",
          "G12"
        ],
        "national_code": null,
        "components": [],
        "pathways": [
          "STEM"
        ]
      },
      {
        "code": "PHY",
        "name": "Physics",
        "short_name": "Phys",
        "kind": "elective",
        "group": "sciences",
        "levels": [
          "G10",
          "G11",
          "G12"
        ],
        "national_code": null,
        "components": [],
        "pathways": [
          "STEM"
        ]
      },
      {
        "code": "HIS",
        "name": "History",
        "short_name": "Hist",
        "kind": "elective",
        "group": "humanities",
        "levels": [
          "G10",
          "G11",
          "G12"
        ],
        "national_code": null,
        "components": [],
        "pathways": [
          "SOC"
        ]
      },
      {
        "code": "GEO",
        "name": "Geography",
        "short_name": "Geog",
        "kind": "elective",
        "group": "humanities",
        "levels": [
          "G10",
          "G11",
          "G12"
        ],
        "national_code": null,
        "components": [],
        "pathways": [
          "SOC"
        ]
      },
      {
        "code": "BST",
        "name": "Business Studies",
        "short_name": "Bus",
        "kind": "elective",
        "group": "applied",
        "levels": [
          "G10",
          "G11",
          "G12"
        ],
        "national_code": null,
        "components": [],
        "pathways": [
          "SOC"
        ]
      },
      {
        "code": "ART",
        "name": "Art and Design",
        "short_name": "Art",
        "kind": "elective",